{
  "$schema": "http://json-schema.org/draft-07/schema#",
  "title": "model schema",
  "type": "object",
  "properties": {
    "v": {
      "type": "array",
      "items": {
        "type": "array",
        "items": {
          "type": "number"
        }
      }
    },
    "vt": {
      "type": "array",
      "items": {
        "type": "array",
        "items": {
          "type": "number"
        }
      }
    },
    "vn": {
      "type": "array",
      "items": {
        "type": "array",
        "items": {
          "type": "number"
        }
      }
    },
    "f": {
      "type": "array",
      "items": {
        "type": "array",
        "items": {
          "type": "string"
        }
      }
    }
  },
  "required": [
    "v",
    "vt",
    "vn",
    "f"
  ]
}
